{
  "schema_version": "1.0-m0a",
  "seed": 4123,
  "source_asset_id": null,
  "sample_rate": 48000,
  "ticks_per_quarter": 960,
  "tempo_milli_bpm": 100000,
  "time_signature": [4, 4],
  "target_bars": 4,
  "strategy": "m0a_four_bar",
  "tail_ms": 2000,
  "mix": {"master_target_peak_dbfs": -1},
  "sections": [
    {"name": "intro", "start_bar": 0, "bars": 1},
    {"name": "groove", "start_bar": 1, "bars": 1},
    {"name": "variation", "start_bar": 2, "bars": 1},
    {"name": "ending", "start_bar": 3, "bars": 1}
  ],
  "tracks": [
    {"instrument": "piano", "gain_db": -10, "pan": -0.23999999999999999, "events": [
      {"start_tick": 0, "duration_ticks": 1280, "note": 60, "velocity": 82},
      {"start_tick": 2400, "duration_ticks": 480, "note": 60, "velocity": 62},
      {"start_tick": 16, "duration_ticks": 1280, "note": 64, "velocity": 79},
      {"start_tick": 2410, "duration_ticks": 480, "note": 64, "velocity": 69},
      {"start_tick": 32, "duration_ticks": 1280, "note": 67, "velocity": 86},
      {"start_tick": 2420, "duration_ticks": 480, "note": 67, "velocity": 61},
      {"start_tick": 48, "duration_ticks": 1280, "note": 71, "velocity": 85},
      {"start_tick": 2430, "duration_ticks": 480, "note": 71, "velocity": 67},
      {"start_tick": 1440, "duration_ticks": 320, "note": 83, "velocity": 78},
      {"start_tick": 3360, "duration_ticks": 320, "note": 79, "velocity": 69},
      {"start_tick": 3840, "duration_ticks": 1280, "note": 60, "velocity": 85},
      {"start_tick": 6240, "duration_ticks": 480, "note": 60, "velocity": 62},
      {"start_tick": 3856, "duration_ticks": 1280, "note": 64, "velocity": 81},
      {"start_tick": 6250, "duration_ticks": 480, "note": 64, "velocity": 65},
      {"start_tick": 3872, "duration_ticks": 1280, "note": 69, "velocity": 78},
      {"start_tick": 6260, "duration_ticks": 480, "note": 69, "velocity": 64},
      {"start_tick": 3888, "duration_ticks": 1280, "note": 72, "velocity": 86},
      {"start_tick": 6270, "duration_ticks": 480, "note": 72, "velocity": 66},
      {"start_tick": 5280, "duration_ticks": 320, "note": 84, "velocity": 76},
      {"start_tick": 7200, "duration_ticks": 320, "note": 81, "velocity": 70},
      {"start_tick": 7680, "duration_ticks": 1280, "note": 59, "velocity": 85},
      {"start_tick": 10080, "duration_ticks": 480, "note": 59, "velocity": 66},
      {"start_tick": 7696, "duration_ticks": 1280, "note": 62, "velocity": 84},
      {"start_tick": 10090, "duration_ticks": 480, "note": 62, "velocity": 67},
      {"start_tick": 7712, "duration_ticks": 1280, "note": 64, "velocity": 85},
      {"start_tick": 10100, "duration_ticks": 480, "note": 64, "velocity": 67},
      {"start_tick": 7728, "duration_ticks": 1280, "note": 67, "velocity": 85},
      {"start_tick": 10110, "duration_ticks": 480, "note": 67, "velocity": 62},
      {"start_tick": 9120, "duration_ticks": 320, "note": 79, "velocity": 75},
      {"start_tick": 11040, "duration_ticks": 320, "note": 76, "velocity": 68},
      {"start_tick": 11520, "duration_ticks": 1280, "note": 60, "velocity": 84},
      {"start_tick": 11536, "duration_ticks": 1280, "note": 64, "velocity": 79},
      {"start_tick": 11552, "duration_ticks": 1280, "note": 67, "velocity": 80},
      {"start_tick": 11568, "duration_ticks": 1280, "note": 71, "velocity": 85},
      {"start_tick": 13440, "duration_ticks": 1920, "note": 81, "velocity": 71}
    ]},
    {"instrument": "bass", "gain_db": -8.5, "pan": 0.040000000000000001, "events": [
      {"start_tick": 0, "duration_ticks": 720, "note": 33, "velocity": 103},
      {"start_tick": 1440, "duration_ticks": 320, "note": 45, "velocity": 80},
      {"start_tick": 1920, "duration_ticks": 720, "note": 33, "velocity": 94},
      {"start_tick": 3360, "duration_ticks": 320, "note": 40, "velocity": 73},
      {"start_tick": 3840, "duration_ticks": 720, "note": 29, "velocity": 107},
      {"start_tick": 5280, "duration_ticks": 320, "note": 41, "velocity": 81},
      {"start_tick": 5760, "duration_ticks": 720, "note": 29, "velocity": 91},
      {"start_tick": 7200, "duration_ticks": 320, "note": 36, "velocity": 72},
      {"start_tick": 7680, "duration_ticks": 720, "note": 31, "velocity": 99},
      {"start_tick": 9120, "duration_ticks": 320, "note": 43, "velocity": 78},
      {"start_tick": 9600, "duration_ticks": 720, "note": 31, "velocity": 92},
      {"start_tick": 11040, "duration_ticks": 320, "note": 32, "velocity": 68},
      {"start_tick": 11520, "duration_ticks": 720, "note": 33, "velocity": 100},
      {"start_tick": 12960, "duration_ticks": 320, "note": 45, "velocity": 83},
      {"start_tick": 13440, "duration_ticks": 1920, "note": 33, "velocity": 97}
    ]},
    {"instrument": "drums", "gain_db": -10.5, "pan": 0.16, "events": [
      {"start_tick": 0, "duration_ticks": 160, "note": 42, "velocity": 71},
      {"start_tick": 540, "duration_ticks": 160, "note": 42, "velocity": 50},
      {"start_tick": 960, "duration_ticks": 160, "note": 42, "velocity": 67},
      {"start_tick": 1500, "duration_ticks": 160, "note": 42, "velocity": 51},
      {"start_tick": 1920, "duration_ticks": 160, "note": 42, "velocity": 73},
      {"start_tick": 2460, "duration_ticks": 160, "note": 42, "velocity": 56},
      {"start_tick": 2880, "duration_ticks": 160, "note": 42, "velocity": 67},
      {"start_tick": 3420, "duration_ticks": 160, "note": 42, "velocity": 53},
      {"start_tick": 0, "duration_ticks": 480, "note": 36, "velocity": 111},
      {"start_tick": 1920, "duration_ticks": 480, "note": 36, "velocity": 107},
      {"start_tick": 960, "duration_ticks": 320, "note": 38, "velocity": 94},
      {"start_tick": 2880, "duration_ticks": 320, "note": 38, "velocity": 101},
      {"start_tick": 3840, "duration_ticks": 160, "note": 42, "velocity": 72},
      {"start_tick": 4380, "duration_ticks": 160, "note": 42, "velocity": 54},
      {"start_tick": 4800, "duration_ticks": 160, "note": 42, "velocity": 66},
      {"start_tick": 5340, "duration_ticks": 160, "note": 42, "velocity": 51},
      {"start_tick": 5760, "duration_ticks": 160, "note": 42, "velocity": 69},
      {"start_tick": 6300, "duration_ticks": 160, "note": 42, "velocity": 58},
      {"start_tick": 6720, "duration_ticks": 160, "note": 42, "velocity": 69},
      {"start_tick": 7260, "duration_ticks": 160, "note": 46, "velocity": 54},
      {"start_tick": 3840, "duration_ticks": 480, "note": 36, "velocity": 108},
      {"start_tick": 5760, "duration_ticks": 480, "note": 36, "velocity": 104},
      {"start_tick": 4800, "duration_ticks": 320, "note": 38, "velocity": 100},
      {"start_tick": 6720, "duration_ticks": 320, "note": 38, "velocity": 102},
      {"start_tick": 7680, "duration_ticks": 160, "note": 42, "velocity": 70},
      {"start_tick": 8220, "duration_ticks": 160, "note": 42, "velocity": 52},
      {"start_tick": 8640, "duration_ticks": 160, "note": 42, "velocity": 66},
      {"start_tick": 9180, "duration_ticks": 160, "note": 42, "velocity": 56},
      {"start_tick": 9600, "duration_ticks": 160, "note": 42, "velocity": 66},
      {"start_tick": 10140, "duration_ticks": 160, "note": 42, "velocity": 57},
      {"start_tick": 10560, "duration_ticks": 160, "note": 42, "velocity": 66},
      {"start_tick": 11100, "duration_ticks": 160, "note": 42, "velocity": 53},
      {"start_tick": 7680, "duration_ticks": 480, "note": 36, "velocity": 112},
      {"start_tick": 9600, "duration_ticks": 480, "note": 36, "velocity": 100},
      {"start_tick": 8640, "duration_ticks": 320, "note": 38, "velocity": 95},
      {"start_tick": 10560, "duration_ticks": 320, "note": 38, "velocity": 100},
      {"start_tick": 10800, "duration_ticks": 120, "note": 38, "velocity": 48},
      {"start_tick": 11040, "duration_ticks": 240, "note": 36, "velocity": 91},
      {"start_tick": 11280, "duration_ticks": 120, "note": 38, "velocity": 65},
      {"start_tick": 11520, "duration_ticks": 160, "note": 42, "velocity": 69},
      {"start_tick": 12060, "duration_ticks": 160, "note": 42, "velocity": 57},
      {"start_tick": 12480, "duration_ticks": 160, "note": 42, "velocity": 66},
      {"start_tick": 13020, "duration_ticks": 160, "note": 42, "velocity": 53},
      {"start_tick": 13440, "duration_ticks": 160, "note": 42, "velocity": 68},
      {"start_tick": 11520, "duration_ticks": 480, "note": 36, "velocity": 110},
      {"start_tick": 13440, "duration_ticks": 480, "note": 36, "velocity": 99},
      {"start_tick": 12480, "duration_ticks": 320, "note": 38, "velocity": 98}
    ]}
  ]
}
